nct_id,title,sponsor,sponsorid,data_request_id,irp,longterm,status,dm_set
NCT00968708,"A Multicenter, Randomized, Double-Blind, Placebo-Controlled Study to Evaluate Cardiovascular Outcomes Following Treatment With Alogliptin in Addition to Standard of Care in...",Takeda,SYR-322_402,00006115,Wellcome Trust,Data has been loaded for this and future requests,Data Package Provided to Requester,DM first search
NCT01032629,"A Randomized, Multicenter, Double-Blind, Parallel, Placebo-Controlled Study of the Effects of JNJ-28431754 on Cardiovascular Outcomes in Adult Subjects With Type 2 Diabetes...",Johnson & Johnson,CR016627,00008697,Yoda Project,Data has been loaded for this and future requests,Data Package Provided to Requester,DM first search
NCT01131676,"A Phase III, Multicentre, International, Randomised, Parallel Group, Double Blind Cardiovascular Safety Study of BI 10773 (10 mg and 25 mg Administered Orally Once Daily) C...",Boehringer Ingelheim,1245.25,00008697,The Independent Review Panel,Data loaded for this request only,Data Package Provided to Requester,DM first search
NCT01989754,"A Randomized, Multicenter, Double-Blind, Parallel, Placebo-Controlled Study of the Effects of Canagliflozin on Renal Endpoints in Adult Subjects With Type 2 Diabetes Mellitus",Johnson & Johnson,CR102647,00008697,Yoda Project,Data has been loaded for this and future requests,Data Package Provided to Requester,DM first search
NCT02065791,"A Randomized, Double-blind, Event-driven, Placebo-controlled, Multicenter Study of the Effects of Canagliflozin on Renal and Cardiovascular Outcomes in Subjects With Type 2...",Johnson & Johnson,CR103517,00008697,Yoda Project,Data has been loaded for this and future requests,Data Package Provided to Requester,DM first search
NCT02465515,"A Long Term, Randomised, Double Blind, Placebo-controlled Study to Determine the Effect of Albiglutide, When Added to Standard Blood Glucose Lowering Therapies, on Major Ca...",GlaxoSmithKline,GLP116174,00006115;00008697,The Independent Review Panel;Wellcome Trust,Data has been loaded for this and future requests,Data Package Provided to Requester,DM first search
